Topic,Documents
-1,"A bill for an act relating to student eligibility requirements in school district, accredited nonpublic school, regent institution, community college, and certain other institution of higher education athletics based on sex, and including effective date provisions. (Formerly HF 2309.) Effective date: 03/03/2022."
-1,"A BILL to be entitled an Act to amend Title 20 of the Official Code of Georgia Annotated, relating to education, so as to provide that it shall be unlawful for Georgia public schools or participating private schools whose students or teams compete against a Georgia public school to operate, sponsor, or facilitate athletic programs or activities that permit a person of one gender to participate in an athletic program or activity that is designated for persons of the opposite gender; to provide for exceptions; to provide for private rights of action and awards of attorney fees; to provide for legislative findings and intent; to provide for definitions; to provide for a short title; to provide for related matters; to repeal conflicting laws; and for other purposes."
0,Establishes guidelines for student participation in athletic contests organized by sex
-1,"A bill for an act relating to student eligibility requirements in school district, accredited nonpublic school, charter school, community college, and regent institution athletics based on sex.(Formerly SSB 3146.)"
-1,"A bill for an act relating to student eligibility requirements in school district, accredited nonpublic school, charter school, community college, and regent institution athletics based on sex.(See SF 2342.)"
3,A bill for an act relating to student eligibility requirements in school district and accredited nonpublic school athletics based on sex.(See HF 2416.)
2,Protect fairness in women's sports.
0,Requiring certain interscholastic and intramural athletic teams or sports sponsored by certain schools to be expressly designated based on biological sex; prohibiting certain entities from taking certain adverse actions against a school or county board of education for maintaining separate interscholastic and intramural athletic teams and sports for students of the female sex; and providing that certain individuals have the right to bring a civil action under certain circumstances.
0,"Schools; athletics; participation in female sports; civil cause of action. Requires each elementary or secondary school or a private school that competes in sponsored athletic events against such public schools to designate athletic teams, whether a school athletic team or an intramural team sponsored by such school, based on biological sex as follows: (i) ""males,"" ""men,"" or ""boys""; (ii) ""females,"" ""women,"" or ""girls""; or (iii) ""coed"" or ""mixed."" Under the bill, male students are not permitted to participate on any school athletic team or squad designated for ""females,"" ""women,"" or ""girls""; however, this provision does not apply to physical education classes at schools. The bill provides civil penalties for students and schools that suffer harm as a result of a violation of the bill. Such civil actions are required to be initiated within two years after the harm occurred.  Schools; athletics; participation in female sports; civil cause of action. Requires each elementary or secondary school or a private school that competes in sponsored athletic events against such public schools to designate athletic teams, whether a school athletic team or an intramural team sponsored by such school, based on biological sex as follows: (i) ""males,"" ""men,"" or ""boys""; (ii) ""females,"" ""women,"" or ""girls""; or (iii) ""coed"" or ""mixed."" Under the bill, male students are not permitted to participate on any school athletic team or squad designated for ""females,"" ""women,"" or ""girls""; however, this provision does not apply to physical education classes at schools. The bill provides civil penalties for students and schools that suffer harm as a result of a violation of the bill. Such civil actions are required to be initiated within two years after the harm occurred."
0,"As introduced, prohibits males from participating in public higher education sports that are designated for females; creates a cause of action for violations that deprive a student of an athletic opportunity or that cause direct or indirect harm to a student at the middle school, high school, or postsecondary level. - Amends TCA Title 49."
5,"Amend KRS 156.070 to designate the NAIA and NJCAA as organizations the Kentucky Board of Education must consider in establishing athletic programs, require the Board of Education or agency designated by the Board of Education to manage interscholastic athletics to promulgate administrative regulations or bylaws requiring schools that participate in interscholastic athletics to designate all athletic teams, activities, and sports based upon the biological sex of the students eligible to participate; prohibit male students from participating in athletic teams, activities, and sports designated as girls'; prohibit designated agencies from entertaining complaints or investigations of policies; a new section of KRS Chapter 158 to create a cause of action against a school that violates these provisions; require that the action be brought within two years; create a new section of KRS Chapter 164 to require a postsecondary education institution to designate all intercollegiate and intramural athletic teams, activities, sports, and events that are sponsored or authorized by the institution based on biological sex of students eligible to participate; require that a postsecondary education institution prohibit male students from participating in athletic teams, activities, and sports designated as women's; prohibit designated agencies from entertaining complaints or investigations of policies; create a cause of action against a postsecondary institution that violates these provisions; require that the action be brought within two years; provide short title of Save Women’s Sports Act."
-1,Modifies and creates provisions regarding elementary and secondary education
2,"Establishes the ""Save Women's Sports Act"" relating to female-only athletics in middle school, high schools, and colleges"
5,"Amend KRS 156.070 to require KHSAA to promulgate administrative regulations or bylaws requiring schools to designate all interscholastic athletics based upon the biological sex of the students eligible to participate; prohibit male students from participating in girls' athletics; establish how to designate biological sex; prohibit designated agencies from entertaining complaints or investigations of policies; create a cause of action against a school that violates these provisions; create a new section of KRS Chapter 164 to require a public postsecondary education institution or private postsecondary education institution that is a member of a national intercollegiate athletic association to designate all intercollegiate and intramural athletics authorized by the institution based on biological sex of students eligible to participate; require that institutions prohibit male students from participating in womens' athletics; prohibit designated agencies from entertaining complaints or investigations of policies; create a cause of action against a postsecondary institution that violates these provisions; title the Act """"Fairness in Womens' Sports Act."""""
-1,Omnibus education policy and finance bill
-1,"As introduced, authorizes a private school to create a policy to regulate a student's participation in the school's athletic activities or events based upon a student's biological sex. - Amends TCA Title 49, Chapter 1 and Title 49, Chapter 50."
3,"AN ACT to create and enact chapter 15.1-41 of the North Dakota Century Code, relating to requiring schools to designate their athletic teams and sports for male, female, or coed participation and limitations on use of governmental property for athletic events."
3,"AN ACT to create and enact chapter 15-10.6 of the North Dakota Century Code, relating to requiring institutions of higher education designating athletic teams and sports for male, female, or coed participation."
0,"Relating to two-year and four-year public institutions of higher education; to amend Section 16-1-52, Code of Alabama 1975, to prohibit a biological male from participating on an athletic team or sport designated for females; to prohibit a biological female from participating on an athletic team or sport designated for males; to prohibit adverse action against a public K-12 school or public two-year or four-year institution of higher education for complying with this act; to prohibit adverse action or retaliation against a student who reports a violation of this act; and to provide a remedy for any student who suffers harm as a result of a violation of this act."
2,Fairness in Women's Sports Act
0,School Athletic Transparency
0,Relating to requiring public institution of higher education students who compete in intercollegiate athletic competitions to compete based on biological sex.
5,Amend KRS 156.070 to remove the statutory eligibility restriction for nonresident student participation in interscholastic athletics; retain eligibility authority with the agency designated to manage interscholastic athletics.
-1,"AN ACT relating to athletics; requiring the Nevada Interscholastic Activities Association to adopt rules and regulations requiring each interscholastic activity or event to be designated based on biological sex; requiring the Board of Regents of the University of Nevada to adopt a policy requiring each interscholastic sport or athletic event that is sanctioned or sponsored by a university, state college or community college within the Nevada System of Higher Education to be designated based on biological sex; requiring each organization for youth sports that sanctions or sponsors competitive sports for youths in this State to adopt a policy requiring each youth sport to be designated based on biological sex; defining certain terms; and providing other matters properly relating thereto."
0,Participation in Extracurricular Activities Amendments
3,AN ACT relating to education; prohibiting students of the male sex from competing on a team designated for students of the female sex as specified; prohibiting retaliation; providing for an administrative hearing as specified; alternatively providing for a commission to determine student eligibility as specified; providing definitions; providing immunity as specified; providing an appropriation; requiring rulemaking; and providing for an effective date.
0,Importance Of Biological Males & Females
4,"To enact sections 3313.5319 and 3345.562 of the Revised Code to enact the Save Women's Sports Act to require schools, state institutions of higher education, and private colleges to designate separate single-sex teams and sports for each sex."
-1,Concerning protecting female students' rights in athletics.
2,Student athletics; creating the Save Men's Sports Act; requiring designation of certain athletic teams. Effective date. Emergency.
0,"K-12 schools and institutions of higher education; designation of interscholastic, intercollegiate, intramural, and club athletic teams and sports based on biological sex; student participation in female teams or sports; civil cause of action. Requires each interscholastic, intercollegiate, intramural, or club athletic team or sport sponsored by a public elementary or secondary school or by a public institution of higher education to be expressly designated as one of the following based on biological sex: (i) males, men, or boys; (ii) females, women, or girls; or (iii) coed or mixed if participation on such team or sport is open to both (a) males, men, or boys and (b) females, women, or girls. The bill requires identification of the student's biological sex on an athletics eligibility form signed by a licensed physician, nurse practitioner, or physician assistant to be submitted by any such student who desires to try out for or participate in an interscholastic, intercollegiate, intramural, or club athletic team or sport. The bill prohibits any such team or sport that is expressly designated for females, women, or girls from being open to students whose biological sex is male. The bill further prohibits any interscholastic, intercollegiate, intramural, or club athletic team or sport sponsored by a public elementary or secondary school or a public institution of higher education from competing against any interscholastic, intercollegiate, intramural, or club athletic team or sport sponsored by a private elementary or secondary school or private institution of higher education in the Commonwealth unless such private school or institution complies with the applicable provisions of the bill.  K-12 schools and institutions of higher education; designation of interscholastic, intercollegiate, intramural, and club athletic teams and sports based on biological sex; student participation in female teams or sports; civil cause of action. Requires each interscholastic, intercollegiate, intramural, or club athletic team or sport sponsored by a public elementary or secondary school or by a public institution of higher education to be expressly designated as one of the following based on biological sex: (i) males, men, or boys; (ii) females, women, or girls; or (iii) coed or mixed if participation on such team or sport is open to both (a) males, men, or boys and (b) females, women, or girls. The bill requires identification of the student's biological sex on an athletics eligibility form signed by a licensed physician, nurse practitioner, or physician assistant to be submitted by any such student who desires to try out for or participate in an interscholastic, intercollegiate, intramural, or club athletic team or sport. The bill prohibits any such team or sport that is expressly designated for females, women, or girls from being open to students whose biological sex is male. The bill further prohibits any interscholastic, intercollegiate, intramural, or club athletic team or sport sponsored by a public elementary or secondary school or a public institution of higher education from competing against any interscholastic, intercollegiate, intramural, or club athletic team or sport sponsored by a private elementary or secondary school or private institution of higher education in the Commonwealth unless such private school or institution complies with the applicable provisions of the bill.  The bill prohibits any government entity, licensing or accrediting organization, or athletic association or organization from entertaining a complaint, opening an investigation, or taking any other adverse action against public school or institution of higher education based on a violation of the provisions of the bill and creates a cause of action for any school or institution of higher education that suffers harm as a result of a violation of the bill. Finally, the bill creates a civil cause of action for any student that suffers harm as a result of a knowing violation of a provision of the bill by a school or institution or as a result of the student's reporting a violation of a provision of the bill by a school, institution, athletic association, or organization."
3,AN ACT relating to school sports; prohibiting students of the male sex from competing on a team designated for students of the female sex as specified; alternatively providing for the state board of education to determine student eligibility as specified; providing definitions; requiring rulemaking; and providing for an effective date.
0,Education; participation in athletic teams provided.
0,Male student participation in female athletics restriction; male access to female changing facilities restriction; criminal establishment
0,Relating to participation in athletic activities based on biological sex; providing a civil right to action for K-12 athletes and college athletes.
0,Requiring certain interscholastic and intramural junior varsity and varsity athletic teams or sports sponsored by certain schools to be expressly designated based on biological sex; prohibiting certain entities from taking certain adverse actions against a school or county board of education for maintaining separate interscholastic and intramural junior varsity and varsity athletic teams and sports for students of the female sex; and providing that certain individuals have the right to bring a civil action under certain circumstances.
-1,Creates the requirement of school sports to designate sexspecific teams for the purpose of gender equality.
0,Participation in athletic teams provision
2,Creates the requirement of school sports to designate sex-specific teams for the purpose of gender equality.
2,To eliminate unfair competition in women's interscholastic sporting competition.
0,Female sports team participation restricted to female sex.
0,To provide civil immunity for interscholastic athletic organizations and the sanctioning bodies of private youth organizations when such entities adopt policies that require an athletic participant to compete on a team that matches the gender identity on the person's birth certificate.
2,Adopt the Sports and Spaces Act
0,"Prohibits athletic organizations from designating, classifying, naming or categorizing as specific for females certain athletic activities for which participation is permitted by persons whose biological sex is male. Prohibits athletic organizations from designating, classifying, naming or categorizing as specific for females certain athletic activities for which participation is permitted by persons whose biological sex is male."
0,"K-12 schools and institutions of higher education; K-12 schools and institutions of higher education; designation of interscholastic, intercollegiate, intramural, and club athletic teams and sports based on biological sex; student participation in female teams or sports; civil cause of action. Requires each interscholastic, intercollegiate, intramural, or club athletic team or sport sponsored by a public elementary or secondary school or by a public institution of higher education to be expressly designated as one of the following based on biological sex: (i) males, men, or boys; (ii) females, women, or girls; or (iii) coed or mixed if participation on such team or sport is open to both (a) males, men, or boys and (b) females, women, or girls. The bill requires identification of the student's biological sex on an athletics eligibility form signed by a licensed physician, nurse practitioner, or physician assistant to be submitted by any such student who desires to try out for or participate in an interscholastic, intercollegiate, intramural, or club athletic team or sport. The bill prohibits any such team or sport that is expressly designated for females, women, or girls from being open to students whose biological sex is male.  The bill prohibits any government entity, licensing or accrediting organization, or athletic association or organization from entertaining a complaint, opening an investigation, or taking any other adverse action against public school or institution of higher education based on a violation of the provisions of the bill and creates a cause of action for any school or institution of higher education that suffers harm as a result of a violation of the bill. Finally, the bill creates a civil cause of action for any student that suffers harm as a result of a knowing violation of a provision of the bill by a school or institution or as a result of the student's reporting a violation of a provision of the bill by a school, institution, athletic association, or organization."
0,Requires school districts to designate athletic competitions and extracurricular sports according to biological sex. Requires school districts to designate athletic competitions and extracurricular sports according to biological sex. Prohibits biological males from participating in athletic competitions or extracurricular sports designated for biological females. Provides causes of action for students and school districts.
0,"Elementary and secondary schools; athletics; participation in female sports; civil cause of action. Requires each public elementary or secondary school and each private elementary or secondary school that competes in sponsored athletic events against such public schools to designate all interscholastic athletic teams and intramural athletic teams sponsored by such school based on biological sex as follows: (i) for ""males,"" ""men,"" or ""boys""; (ii) for ""females,"" ""women,"" or ""girls""; or (iii) as ""coed"" or ""mixed"" if such team is open to participation by (a) ""males,"" ""men,"" or ""boys"" and (b) ""females,"" ""women,"" or ""girls."" The bill prohibits students whose biological sex is male from participating on any school athletic team or squad designated for ""females,"" ""women,"" or ""girls."" Finally, the bill creates a civil cause of action for students and schools that suffer harm as a result of a violation of the provisions of the bill, provided that such action is initiated within two years of the harm occurring."
0,"K-12 schools and institutions of higher education; K-12 schools and institutions of higher education; interscholastic, intercollegiate, intramural, and club athletic teams and sports; participation on teams based on biological sex; certain requirements; civil cause of action. Requires each public elementary or secondary school and each public institution of higher education to expressly designate all interscholastic, intercollegiate, intramural, or club athletic teams and sports sponsored by such school based on biological sex as follows: (i) for ""males,"" ""men,"" or ""boys""; (ii) for ""females,"" ""women,"" or ""girls""; or (iii) as ""coed"" or ""mixed"" if such team or sport is open to participation by both (a) males, men, or boys and (b) females, women, or girls. The bill provides that a student's ""biological sex"" is the statement of such student's biological sex on such student's official birth certificate if the statement was filed at or near the time of the student's birth. The bill prohibits any student whose biological sex is female from participating on any interscholastic, intercollegiate, intramural, or club team or sport that is expressly designated for ""males,"" ""men,"" or ""boys,"" unless such school or institution does not offer an equivalent team or sport that is expressly designated for ""females,"" ""women,"" or ""girls,"" or as ""coed"" or ""mixed."" The bill also prohibits any student whose biological sex is male from participation on any interscholastic, intercollegiate, intramural, or club team or sport that is expressly designated for ""females,"" ""women,"" or ""girls."" Furthermore, the bill prohibits any interscholastic, intercollegiate, intramural, or club athletic team or sport that is sponsored by a public elementary or secondary school or sponsored by a public institution of higher education from competing against any interscholastic, intercollegiate, intramural, or club athletic team or sport that is sponsored by a private elementary or secondary school or a private institution of higher education unless such private school or institution also complies with the provisions of the bill. Finally, the bill creates a civil cause of action for students that suffer any deprivation, harm, retaliation, or adverse action or for schools that suffer any harm as a result of a violation of the provisions of the bill, provided that such action is initiated within two years of such deprivation, harm, retaliation, or adverse action."
2,"Creates the """"Save Women's Sports Act"""" and provisions regarding usage of school locker rooms"
2,"Establishes the ""Save Women's Sports Act"" relating to female-only athletics in middles schools, high schools, and colleges"
0,Prohibits an athletic team sponsored by a school from allowing a student to compete in an athletic competition designated for the opposite biological sex
2,"Establishes the ""Save Women's Sports Act"" relating to female-only athletics in middle schools, high schools, and colleges"
2,"Establishes the """"Save Women's Sports Act"""""
